{
  "id": "tactic:bestia:enemy-return",
  "name": {
    "ja": "リングへ戻る",
    "en": "Return to the ring"
  },
  "when": {
    "all": [
      {
        "self": {
          "at_node": "node:outside"
        }
      }
    ]
  },
  "do": [
    {
      "move_to": "node:center"
    }
  ],
  "expect": {
    "reflex": true
  },
  "because": [
    "state:bestia:battle-ai"
  ],
  "knowledge": "discoverable",
  "confidence": "authored",
  "superseded_by": null
}
